year,week,week_day,recipe_id,description,title,url
2021,43,Ukens bakst,13b3f3bb-8e09-4190-9fcc-66399ec440ae,Her har en søt slager fått et skummelt utseende! Slipp kreativiteten løs og gjør muffinsene til halloweenfesten om til både spøkelser og monstre. Skummelt tips: Lag en blodig kjerne på muffinsene så får du hjerne-muffins! Eller bruk smørkrem i ulike farger for kreative cupcake monstre. Oppskriften gir ca 24 muffins. Se steg i video.,Halloween muffins,/oppskrifter/bakst/muffins/halloween-muffins/
2021,42,Mandag,4b212176-3650-4828-a894-58daba5f7f34,"Ramen betyr ""strukne nudler"" og er en tradisjonell japansk nudelsuppe. Med denne raske oppskriften på ramen suppe lager du enkelt den populære asiatiske retten hjemme!",Rask ramen,/oppskrifter/Suppe/rask-ramen/
2021,42,Tirsdag,51f1de37-0b3b-422f-b0ef-0511becb3bbf,"Oppskrift på fersk tagliatelle med kremet pastasaus, ørretfilet og sukkererter. Enkel, rask og veldig god middag på under 20 minutter.",Kremet  pasta med ørret,/oppskrifter/Pasta/kremet--pasta-med-orret/
2021,42,Onsdag,665d4ffc-abc2-40c7-9132-d879a33f82e3,"Saftige karbonader med kremet sjampinjongstuing, potetmos og grønnsaker er klassisk tradisjonsmat. Enkel og veldig god middag på under 20 minutter. Både biffkarbonader og elgkarbonader kan brukes. Se også video.",Elgkarbonader med soppstuing,/oppskrifter/Vilt/Elg/karbonader-med-soppstuing/
2021,42,Torsdag,53b2bcba-deff-7cbf-eab2-c03b122eae76,"Her er en oppskrift på en pai med kylling, squash, persille, gressløk, mozzarella og kremfløte. Lag din egen paibunn eller spar mye tid ved å bruke ferdig. Server med en frisk blandet salat. Denne paien passer både som middag til 4 personer eller som forrett til 6 personer.",Kyllingpai med mozzarella,/oppskrifter/Pai/Kyllingpai/
2021,42,Fredag,78b7aace-9c0f-4164-86b5-e0b28fb47e1a,"Litt sunnere taco? Prøv denne oppskriften på enkel og god fisketaco med tacokrydret torsk, strimlet kål, guacamole, aioli, lime og koriander. Guacamole kan du kjøpe ferdig eller lage selv.","Taco med torsk, kål og guacamole",/oppskrifter/Taco/taco-med-torsk-guacamole/
2021,42,Lørdag,afbda143-ca75-43b4-aabf-600b2fb3ebcb,"Oppskrift på mørt, norsk viltkjøtt, servert med blåmuggost og en lun salat av potet og pære. Kjempegod helgemat, og festmat, med høstens gode råvarer.",Ovnsbakt reinsdyrfilet med Selbu Blå og pære,/oppskrifter/Vilt/Reinsdyr/ovnsbakt-reinsdyrfilet-med-selbu-bla-og-pare/
2021,42,Søndag,29f3abae-6101-42f5-9aeb-b5d56258a85f,"Marokkansk lammegryte med spennende krydder, eple, tørket aprikos og granateple. En nydelig, hjemmelaget høstgryte med en ny vri. Som alternativ til lammekjøtt kan du også bruke sauekjøtt.",Marokkansk lammegryte,/oppskrifter/Lam/marokkansk-lammegryte/
2021,42,Ukens bakst,7500bc9e-9fd7-4511-bc1b-65c5523aa3b8,"Enkel oppskrift på grytebrød, eltefritt brød eller no-knead-bread om du vil, med hvetemel og rug i gryte og sprø skorpe. Eltefri deig lages kvelden før for nystekt brød til frokost eller lunsj. Eltefrie deiger trenger veldig lite gjær, men blir likevel luftige og gode brød. 1 porsjon gir 1 stk stort brød.",Eltefritt grytebrød,/oppskrifter/bakst/brod/eltefritt-grytebrod/
2021,41,Mandag,dcdbf081-d518-4f84-b367-76bfeb4c37f3,"Bourguignon er en kraftig vinkokt gryterett som stammer fra regionen Bourgogne i Frankrike. Denne kjøttfrie varianten er full av smak, og et veldig godt alternativ for vegetarianere, eller deg som bare ønsker å spise litt mindre kjøtt.",Vegetar bourguignon,/oppskrifter/vegetar/vegetar-bourguignon/
2021,41,Tirsdag,3b9bb186-aedc-8ef3-042d-a4f193bd1eca,"Klassisk oppskrift på ostegratinerte krabbeskjell. Her har vi blandet krabbekjøttet med chili, rødløk, dill og creme fraiche som gir ekstra god smak når krabben gratineres. En enkel oppskrift som passer fint til forrett eller middag servert med godt brød, en skvis sitron og grønn salat ved siden av.",Gratinert krabbeskjell,/oppskrifter/Skalldyr/Krabbe/gratinert-krabbeskjell/
2021,41,Onsdag,d4d3d2a0-3975-47e5-9326-f584dcafd496,"Koteletter er raskt og enkelt å tilberede, og smaker veldig godt. I denne oppskriften får kotelettene følge av saltkokte poteter, friske grønnsaker og en herlig rødvinssaus som bare trenger å varmes før servering. Både svinekoteletter og nakkekoteletter kan brukes.",Nakkekoteletter med rødvinssaus,/oppskrifter/Svin/Koteletter/koteletter-med-rodvinssaus/
2021,41,Torsdag,ec5efdd9-b272-40cb-aade-bb6638b10ff6,"Oppskrift på rask fiskegryte inspirert av bacalao. Denne gode gryten blir like god med torsk, skrei eller biter av klippfisk! Og med ferdig tomatsaus, løk og oliven får du en veldig god middag på under 20 minutter.",Enkel bacalao,/oppskrifter/Fisk/Torsk/enkel-bacalao/
2021,41,Fredag,e2fde9b9-4d27-493f-9266-d03879c4298d,"Oppskrift på verdens beste og enkle quesadilla med kylling, smeltet ost og tacokrydder. Dette er en av barnas favoritter, og et godt alternativ til klassisk taco på fredag. Du kan også bytte ut kyllingfilet med kyllingkjøttdeig. Passer perfekt å lage på fredager eller en travel hverdag.",Quesadillas med kylling,/oppskrifter/Taco/kylling-quesadillas/
2021,41,Lørdag,887ef752-bdbd-dcce-59a4-dcdaaa160f71,"Oppskrift på smaksrik italiensk pizza laget fra bunnen. Få, men gode ingredienser som topping og hjemmelaget saus gjør dette til en veldig god pizza. Til denne oppskriften trenger du <a href='/oppskrifter/pizza/enkel-italiensk-pizzadeig/'>ferdig hevet grunndeig til pizza</a>.",Hjemmelaget italiensk pizza med bacon,/oppskrifter/pizza/hjemmelaget-italiensk-pizza-med-bacon/
2021,41,Søndag,615249b8-f9cb-f994-a713-1734f1e60b8e,"Oppskrift på møre og smaksrike lammeskanker, bresert i ovn. Å bresere er når man først bruner kjøttet og så langtidssteker det i en kjele i ovnen med væske, slik at man får god kraft. Dette er nydelig høstmat med mørt og smaksrikt kjøtt som faller av benet.",Bresert lammeskank,/oppskrifter/Lam/Bresert-lammeskank/
2021,41,Ukens bakst,b7875d16-0056-4973-d2ec-c11266429621,"Oppskrift på enkle muffins med bringebær. Vi bruker kefir for ekstra saftige muffins. Du kan bruke både frosne og friske bær, og variere disse etter smak. Blåbær er like godt, eller sjokoladebiter om du ønsker. Oppskriften gir ca 24 muffins. Se steg i video.",Bringebærmuffins,/oppskrifter/bakst/muffins/muffins-med-bringebar/
2021,40,Mandag,ac5b9557-6f0e-46d0-aa25-a21e6f9b5f8d,"Oppskrift på spicy og smakfull asiatisk grønnsakssuppe med nudler og red curry paste. Suppen er vegetar, men om du ønsker kan du tilsette strimlet kylling. Thaisuppe som går raskt å lage, og passer perfekt både til hverdag og helg.",Asiatisk suppe med nudler,/oppskrifter/Suppe/asiatisk-suppe-med-nudler/
2021,40,Tirsdag,7425e6d7-2826-4a77-9acd-0c217b6cc9fb,"Oppskrift på en god gammel klassisker - panert sei med ovnsbakte poteter og søt, silkemyk gulrotpure. Enkel, litt sunnere og veldig god fiskemiddag for hele familien. Vi bruker panert sei, men her kan du velge den du liker best.",Panert sei med gulrotpuré,/oppskrifter/Fisk/panert-sei-med-gulrotpure/
2021,40,Onsdag,62cb6733-d0c3-4daa-ad31-4ef6d4eac281,"Reinskavgryte er en tradisjonell samisk gryterett med viltkjøtt. Denne oppskriften med skav av reinsdyr, bacon, geitost, sopp og einebær er enkel og rik på smak. Server gjerne med hjemmelaget potetmos og tyttebærsyltetøy.",Klassisk finnbiff,/oppskrifter/gryte/finnbiff/
2021,40,Torsdag,422c93cb-c80c-446a-8649-7c5aca6d4817,"Oppskrift på en rask og enkel wok til middag, med strimlet svin, grønnkål, nudler og en skikkelig god hoi sin saus. Tilsett gjerne flere strimlede grønnsaker etter smak. Se også video.",Wok med svinekjøtt og nudler,/oppskrifter/wok/wok-med-svinekjott-og-nudler/
2021,40,Fredag,10e725a6-3d65-4148-b267-99d4b7e22375,"Oppskrift på bifftaco inspirert av det autentiske meksikanske kjøkken. I Mexico brukes ofte kjøtt av geit, men også storfe som her. Spesielt for Birria taco er at kjøttet er langtidsstekt. Vi topper med masse gode smaker fra Broken Taco.",Pulled Beef Birria taco,/oppskrifter/Taco/pulled-beef-birria-taco/
2021,40,Lørdag,4f49c02a-9ff8-4653-ab7b-1992fd329ae2,"Oppskrift på klassisk hawaiipizza, en av barnas favoritter, med ost, skinke, ananas og paprika. Bunnen kan du kjøpe ferdig eller lage selv. <a href='/oppskrifter/pizza/rask-italiensk-pizzadeig'>Prøv denne oppskriften på rask og enkel på pizzadeig</a>.",Hawaii pizza med skinke og ananas,/oppskrifter/pizza/hawaii-pizza-med-skinke-og-ananas/
2021,40,Søndag,f27ffc43-1a26-c1a8-24b4-9b46b408d448,"Grunnoppskrift på tradisjonell, langtidsstekt lammestek med hvitløk og rosmarin og sjysaus. Vi tar deg gjennom stegene til perfekt og saftig lammestek, samt tips til godt tilbehør. Se video for hvordan tilberede og steke lammestek og lammelår.",Klassisk lammestek med hvitløk og rosmarin,/oppskrifter/Lam/Lammestek/klassisk-lammestek/
2021,40,Ukens bakst,656fc3bf-9efe-7f3a-31a0-781c12ab7af3,"Kanelknuter, kanelsnurrer, kanelboller eller kanel i svingene, kjært barn har mange navn. Vi gir deg oppskriften på søte, luftige boller fylt med deilig sukker og kanel. 1 porsjon gir 15-20 kanelboller avhengig av størrelse. Se også  video for steg for steg.",Kanelsnurrer,/oppskrifter/bakst/Sot-gjarbakst/kanelsnurrer/
2021,39,Mandag,49ef9c6f-b7bf-4b63-aacd-68006a175420,"Oppskrift på enkel og barnevennlig pastagrateng med tomatsaus, gulrot og smeltet ost. Denne vegetarpastaen lager du på under 30 minutter, og kan fort bli barnas nye hverdagsfavoritt.",Kjøttfri pastagrateng,/oppskrifter/vegetar/kjottfri-pastagrateng/
2021,39,Tirsdag,5f99778e-ed77-4abd-b316-2a18122418b3,"Oppskrift på rask og enkel middag på under 20 minutter! Denne oppskriften er litt sunnere, og en av barnas favoritter med fiskekaker, ovnsbakte poteter, sprø råkost og hvit saus.",Fiskekaker med råkostsalat,/oppskrifter/Fisk/fiskekaker-med-rakostsalat/
2021,39,Onsdag,dc620ba4-a556-4806-9cf9-6e56e9e7363b,"Oppskrift på populær og varmende suppe, med kylling, god kraft, kokosmelk, tomat og krydder som gjør den akkurat passe sterk. Server til middag med grove baguetter og mykt smør. Dette er en spicy kyllingsuppe som passer perfekt å servere i hverdagen.",Hot kyllingsuppe med eple og gulrot,/oppskrifter/Suppe/hot-kyllingsuppe-med-eple-og-gulrot/
2021,39,Torsdag,0403bedd-5518-79cf-a197-cbe7992106a6,"Klassisk og god oppskrift på fårikål. Retten er enkel å lage, men kjøttet skal trekke i ca. 2,5 time. Du kan gjerne lage fårikål dagen i forveien. Fårikål regnes av mange som Norges nasjonalrett og et av høstens gastronomiske høydepunkter. Som alternativ til fårikålkjøtt av lam, kan du bruke sauekjøtt. Se video for steg for steg.",Tradisjonell fårikål,/oppskrifter/Lam/Farikal/
2021,39,Fredag,aab5bbd2-2a55-4c36-8e27-a88411bd627c,"Oppskrift på rask og enkel kjøttdeigpizza i langpanne. Her kan du  bruke enten kjøttdeig eller karbonadedeig, og vi topper den gjerne med søte små tomater. Med ferdig bunn får du en god middag på under 20 minutter.",Enkel pizza med tomat,/oppskrifter/pizza/pizza-med-kjottdeig-og-tomat/
2021,39,Lørdag,12bb00f4-d059-47a4-a9d0-b1693e6ee8e1,"Oppskrift på pepperkrabbe, en asiatisk rett med krabbeklør og hjemmelaget saus basert på blant annet soyasaus, østerssaus, den søte soyasausen ketjap manis, chili, ingefær og en tydelig smak av pepper. Digg og klissete helgemat!",Pepperkrabbe,/oppskrifter/Skalldyr/Krabbe/pepperkrabbe/
2021,39,Søndag,42aaa6ff-eaf8-4c1b-8925-55e245a56678,"Oppskrift på risotto med god kraft, tørket steinsopp og parmesan. En italiensk favoritt som er like god alene som tilbehør til kylling eller biff. Du kan også bruke annen tørket eller fersk sopp.",Steinsopprisotto,/oppskrifter/ris/steinsopprisotto/
2021,39,Ukens bakst,cca9a60b-69cc-42a3-a431-f9911d617b23,"Oppskrift på klissete og mektig konfektkake med mørk sjokolade. Vi bruker en rund springform på 20-22 cm i diameter, og kaken er til 8 personer.",Konfektkake,/oppskrifter/kaker/sjokoladekaker/konfektkake/
2021,38,Mandag,ba8f3186-d26b-498d-91f3-8c756af448c9,"Oppskrift på terte, eller pai, med høstens gode råvarer. Her bruker vi beter, rødløk og pære, og resultatet blir en fargerik og litt søtlig pai som både kan serveres som egen vegetarrett, og som tilbehør til kjøtt.","Rustikk terte med beter, rødløk og pære",/oppskrifter/Pai/Rustikk-terte-med-beter-rodlok-og-pare/
2021,38,Tirsdag,b667803d-eec8-4e6f-99ee-e90166ff6f9b,"Pokesalat er en spennende og enkel fiskemiddag. Bruk rå lakseloin, råkost og ris, og topp med asiatisk ponzusaus. Retten kan tilpasses etter ønske med for eksempel mango, avokado og granateplekjerner.",Enkel poke med laks,/oppskrifter/Fisk/Laks/enkel-poke-med-laks/
2021,38,Onsdag,7e9c0e26-666e-4448-ad12-d2f8bcd08451,"En enkel variant av stroganoff gryte med kjøttpølse, servert med potetmos. Med ferdig grytebase og potetmos blir denne oppskriften en rask middag som barna elsker på under 20 minutter. Du kan også bruke andre pølser, også vegetarpølser.",Stroganoff med pølse,/oppskrifter/Polser/stroganoff-med-polse/
2021,38,Torsdag,1e34e87d-ad37-7d33-00c0-c8a477f360e4,"Oppskrift på klassisk blomkålsuppe med melk, toppet med sprøstekt bacon. Hjemmelaget blomkålsuppe er enkel og rask hverdagsmat. Server med krutonger i eller godt brød til så blir dette en mettende middag.",Blomkålsuppe,/oppskrifter/Suppe/Blomkalsuppe/
2021,38,Fredag,3c822f4e-8c7b-49e7-a509-51a6b94cb158,"Oppskrift på fristende, gratinert enchilada med saftig kylling, en spicy tomatsaus og masse smeltet ost. Server med gjerne med hjemmelaget guacamole som tilbehør. Denne retten går fort å lage i ovnen og er skikkelig tex-mex kosemat til hverdag og helg. Se video for steg-for-steg.",Enchiladas med kylling,/oppskrifter/Taco/enchiladas-med-kylling/
2021,38,Lørdag,000d3e4b-5acc-3c91-196f-58ccb4f27df2,"Oppskrift på saftig kveite med en god grønnsakspure. Kveite er en delikatesse og en riktig festfisk. Stekt kveitefilet med potet- og sellerirotmos, stekt spinat og sauce vierge er et skikkelig festmåltid! Man kan også bytte ut kveite med torsk, steinbit eller breiflabb.",Stekt kveite med sellerirotpure og stekt spinat,/oppskrifter/Fisk/Kveite/Stekt-kveitefilet-med-sellerirotstappe-og-sauce-vierge/
2021,38,Søndag,ab1e9cbe-46ee-4276-adc6-66ca4c3e1d5b,"Enkel oppskrift på varmende suppe med oksekjøtt og høstens rotgrønnsaker. Klassisk tradisjonsmat, perfekt på en kald høst- eller vinterkveld. Varier gjerne kjøtt og grønnsaker etter sesong eller det du har tilgjengelig.",Klassisk kjøttsuppe,/oppskrifter/Suppe/kjottsuppe/
2021,38,Ukens bakst,4e30c35b-7fe4-23f0-1dfa-7f9ba9a27557,"Oppskrift på saftig eplekake i rund form med ekte vanilje. Brunt sukker gir kaken en litt karamellaktig smak. Denne oppskriften passer til en rund form på 22 cm. Kaken kan også lages i langpanne, da dobler du mengden. Se steg for steg i video. Topp gjerne med mandelflak!",Klassisk eplekake,/oppskrifter/kaker/Frukt--og-barkaker/Eplekake/
2021,37,Mandag,1fcd4eb3-ff7e-5a65-a1e8-c0db2386dba5,"Oppskrift på nydelig, kjøttfri lasagne med cherrytomater, spinat og hjemmelaget ostesaus. En av våre mest populære vegetar oppskrifter! Oppskriften passer til en liten ildfast form.",Vegetarlasagne,/oppskrifter/Pasta/Lasagne/Vegetarlasagne/
2021,37,Tirsdag,6faa91c5-0005-4795-8600-122ab244a9ee,"Oppskrift på stekt ørretfilet servert med våre egen spicy red curry full av smak, og kokt ris. Enkelt og veldig godt middagstips, som du lager på under 20 minutter. Laks kan også brukes.",Red curry med ørret,/oppskrifter/Fisk/red-curry-med-orret/
2021,37,Onsdag,ec51fd54-a718-4245-8949-45a76bf603d5,"Oppskrift på hjemmelaget potetsuppe med gode poteter, fløte, sennep og tørrsaltet bacon. Suppe er enkelt å lage og smaker veldig godt, spesielt på høsten. En sikker vinner for både barn og voksne.",Kremet potetsuppe med bacon,/oppskrifter/Suppe/kremet-potetsuppe-med-bacon/
2021,37,Torsdag,6173f505-c087-47b2-81bb-b2efcc50f3f0,"Oppskrift på saftige nakkekoteletter av svin, med hoisinsaus og byggrynsalat. En enkel og veldig god hverdagsmiddag 20 minutter. Tilsett gjerne ekstra grønnsaker du har liggende, til salaten.",Nakkekoteletter med byggrynsalat,/oppskrifter/Svin/Koteletter/nakkekoteletter-med-byggrynsalat/
2021,37,Fredag,8f5cc4fa-5cc6-8744-00af-1d227f6326d3,"Tacopizza er en super måte å bruke opp rester fra tacoen på. Ha tacokjøttdeig, mais, salsa og annet du har igjen på tortillas og stek i ovnen. En perfekt fredagsmiddag for hele familien!",Tacopizza,/oppskrifter/pizza/Tacopizza/
2021,37,Lørdag,2cf59488-b3d1-4563-917a-e6e4a0c0869c,"Oppskrift på enkel miniburger med krabbekjøtt i brioche med hjemmelaget chilimajones med srirachasaus. En imponerende middag du kan lage når du vil unne deg og gjestene noe ekstra godt! Denne burgeren er like god på sommeren, som på høsten med sesongens krabbe.",Sliders med krabbe og srirachamajones,/oppskrifter/Skalldyr/Krabbe/sliders-med-krabbe-og-srirachamajones/
2021,37,Søndag,381391db-61c2-6b03-526f-6ce7c2556878,"Oppskrift på lammegryte med høstens rotgrønnsaker, friske urter og fransk sennep. Bruk gjerne lammelår eller lammebog, alternativt sauekjøtt. Potetpurè, eller potetmos, er godt tilbehør til lammegryte.",Lammegryte med rotgrønnsaker,/oppskrifter/gryte/Lammegryte-med-rotgronnsaker/
2021,37,Ukens bakst,147de13d-776f-76bb-2178-ecd6672076c1,"Kvikk Lunsj-kake er en saftig sjokoladekake pyntet Kvikk lunsj sjokolade og toppet med non stop! Passer til enhver anledning, påske, dåp, bursdag, farsdag og bryllup, uansett - denne kaken imponerer! Her får du en enkel oppskrift med steg-for-steg bilder i rundform.",Kvikklunsjkake,/oppskrifter/kaker/sjokoladekaker/Kvikklunsjkake/
2021,36,Mandag,d34e1db6-f38b-8c80-9b98-3c29803b5862,"En sunn suppe som lages raskt, med få ingredienser. Brokkoli er sunt, godt og fargerikt. Denne suppen er med løk, og kan bli en kremet brokkolisuppe om du tilsetter fløte eller en klatt crème fraîche.",Brokkolisuppe,/oppskrifter/Suppe/Brokkolisuppe/
2021,36,Tirsdag,45365543-d026-4d10-9435-877b9f0bfbc5,"Oppskrift på enkel, rask, og litt sunnere middag med fisk. Denne smakfulle retten med stekt laks, kremet sellerirotmos og syltet rødløk lager du enkelt på under 20 minutter, og den egner seg like godt til hverdag som til helg.",Laksefilet med sellerirotmos,/oppskrifter/Fisk/Laks/laksefilet-med-sellerirotmos/
2021,36,Onsdag,0e2e6241-54a8-fa88-fef5-5b46c66e2ccf,"Oppskrift på en av barnas favoritter, ovnsbakt grateng med pølser og pasta. En enkel og god hverdagsmiddag for hele familien. Bruk kjøttpølser eller grillpølser. Denne barnevennlige middagen med makaroni, pølse og pastasaus går fort å lage. Se tips for å gjøre den litt sunnere.",Pølsegrateng med pasta,/oppskrifter/Pasta/polsegrateng-med-pasta/
2021,36,Torsdag,6e738d02-295a-452d-a688-240c1041c0ba,"Oppskrift på stekt kveite med nydelig hollandaise saus, stekte småpoteter, spinat og syrlig granateple. En enkel hverdagsrett klar på under 20 minutter. Du kan også bruke torskefilet. Bruk gjerne Jacobs Utvalgte hollandaise.",Kveite med spinat og hollandaise,/oppskrifter/Fisk/Kveite/kveite-med-spinat-og-hollandaise/
2021,36,Fredag,862a070c-0342-436d-ab18-0ce8a363e8e5,"Oppskrift på kjempegod, kjøttfri taco med ovnsbakte søtpoteter, avokado og syltet rødløk. Søtpotene krydrer vi med hjemmelaget tacokrydder. Du kan velge å kjøpe syltet rødløk ferdig for enklere taco. Se stegene i video.",Vegetartaco med søtpotet,/oppskrifter/vegetar/vegetartaco-med-sotpotet-avokado-og-syltet-rodlok/
2021,36,Lørdag,68604fd5-a49b-40e4-95fc-3959b7372d50,"Rask, enkel, hjemmelaget pizza med gode råvarer. Smaksrik ost og chorizopølse gir denne pizzaen masse smak, og ferdig pizzabunn sparer mye tid. Digg middag for liten og stor. Ha gjerne også litt revet cheddar på toppen for ekstra smak.",Pizza med chorizo og Bufarost,/oppskrifter/pizza/pizza-med-chorizo-og-bufarost/
2021,36,Søndag,8bfcd497-cdde-4067-8276-a3f24effa277,"Oppskrift på enkel, mild butter chicken med kokt ris og mykt naan brød. Butter chicken er en mild indisk saus, med blant annet fløte, garam masala, koriander og kardemomme. Middagstips på under 20 minutter.",Enkel butter chicken,/oppskrifter/Kylling/enkel-butter-chicken/
2021,36,Ukens bakst,6e2a4ca0-c9fb-4194-a02f-821a52839fd8,"Oppskrift på hjemmebakt ""pull apart"" hvitløksbrød, der du kan rive skivene fra hverandre, slik at masse nydelig hvitløk og smeltet ost kommer til syne hele veien gjennom. Vi viser deg stegene til dette gode brødet, perfekt som tilbehør til suppe, pasta og grillmat. Oppskriften gir 1 brød.",Hjemmelaget hvitløksbrød,/oppskrifter/bakst/brod/hjemmelaget-hvitloksbrod/
2021,35,Mandag,216f8a4c-4d06-075f-be36-3f9dc0f5ae8e,"Falafel er populær hurtigmat i Midtøsten. De små ""kjøttbollene"" inneholder ikke kjøtt, men er laget av kikerter. Dette er sunn vegetarmat full av gode smaker. Serverer hjemmelaget falafel i pita med frisk agurksalat og det blir nydelig, mettende og sunt.",Falafel i pitabrød,/oppskrifter/vegetar/Falafel-i-pitabrod/
2021,35,Tirsdag,c1f87a51-7024-49ee-97ae-cf84d01ee083,"Oppskrift på rask, spicy wok med argentinske villreker, ris og szechuan saus. Villreker ligner på scampi, men det er ikke oppdrett, og de lever i det iskalde havet utenfor Argentina.",Wok med villreker,/oppskrifter/wok/wok-med-villreker/
2021,35,Onsdag,7d9a6e4e-9d34-4715-bf08-5b65f709d664,"Oppskrift på italiensk minestronesuppe, med gode hermetiske tomater, chorizo og pasta. Et godt middagstips for hele familien! Server gjerne med nystekte rundstykker.",Klassisk minestronesuppe,/oppskrifter/Suppe/klassisk-minestronesuppe/
2021,35,Torsdag,4c62f921-fdae-41d9-a230-4369ff1e14c5,"Ukens middag på under 20 minutter! Familievennlig middagsfavoritt med fersk tagliatelle med fullkorn, og ferdig tomatsaus med ekstra grønnsaker. Både kjøttdeig og karbonadedeig kan brukes. Se også video.",Pasta med kjøttsaus,/oppskrifter/Pasta/pasta-med-kjottsaus/
2021,35,Fredag,3c822f4e-8c7b-49e7-a509-51a6b94cb158,"Oppskrift på fristende, gratinert enchilada med saftig kylling, en spicy tomatsaus og masse smeltet ost. Server med gjerne med hjemmelaget guacamole som tilbehør. Denne retten går fort å lage i ovnen og er skikkelig tex-mex kosemat til hverdag og helg. Se video for steg-for-steg.",Enchiladas med kylling,/oppskrifter/Taco/enchiladas-med-kylling/
2021,35,Lørdag,a4487c90-de88-4f82-9b94-2f95511cd2cb,"Spekemat er enkelt og kan danderes til lekre spekefat når du skal ha gjester. Her kan alle varianter av spekeskinker og spekepølser blandes, og gjerne serveres med frisk frukt, bær og gode oster. Vi gir deg noen tips!",Festfat med spekemat,/oppskrifter/spekemat/festfat-med-spekemat/
2021,35,Søndag,994eb75e-c50c-47c3-b6c2-99547cf8bd30,"Oppskrift på ovnsbakt Telemarkrøye med hjemmelaget agurksalat og kokte perlepoteter. Et godt middagstips til hverdags, eller når du får middagsgjester.",Hel ovnsbakt Telemarkrøye,/oppskrifter/Fisk/hel-ovnsbakt-telemarkroye/
2021,35,Ukens bakst,2bcd5e70-acce-6004-b303-59c66cad897b,"Oppskrift på smaksrik, saftig og søt plommekake. Når de norske plommene er i sesong, er det en god grunn til å bake kake. Sammen med sitronskall og ekte vanilje blir dette en nydelig kake som gjerne kan serveres sammen med vaniljeis. Denne kaken kan også lages på grillen.",Plommekake med vanilje,/oppskrifter/kaker/Frukt--og-barkaker/Plommekake-med-vanilje-og-sitron/
2021,34,Mandag,71a4070c-feee-f955-646b-461a2b68a119,"En vegetarisk oppskrift på grønnsakslasagne full av smak. Her er kjøttdeigen byttet ut med søtpotet og aubergine, ostesausen med en blomkålpuré og lasagneplatene med ulike grønnsaker i tynne skiver. Perfekt vegetarlasagne hvor du kan bruke en rekke grønnsaksrester.","Grønnsakslasagne med søtpotet, aubergine og grønnkål",/oppskrifter/Pasta/Lasagne/Gronnsakslasagne-med-sotpotet-aubergine-og-gronnkal/
2021,34,Tirsdag,8ea6d30c-1236-4f26-932f-f02cc42f3c20,"Oppskrift på salmaburger med chilimajones og syltet rødløk, en nydelig kombo. Fiskeburger i ferske, grove burgerbrød utgjør en rask, god og litt sunnere hverdagsmiddag på under 20 minutter. Du kan gjerne grille burgerne!",Lakseburger med syltet rødløk,/oppskrifter/Fisk/Laks/lakseburger-med-syltet-rodlok/
2021,34,Onsdag,b4cebb07-2732-4d85-b331-c53f87f390d0,"Oppskrift på rask, god og enkel middag med strimlet kylling. Med utgangspunkt i en ferdig pastasalat kan du raskt supplere med ekstra grønnsaker og stekt kylling. Topp med en god dressing og server gjerne med ferskt brød.",Pastasalat med kylling,/oppskrifter/Pasta/pastasalat-med-kylling/
2021,34,Torsdag,cbf082fa-38b1-4395-b3a7-0a0546333861,"Oppskrift på blomkålsuppe uten hvetemel, med sprøstekt bacon, kikerter og grønnkål. Hjemmelaget blomkålsuppe er enkel og rask hverdagsmat. Servert med krutonger eller godt brød til, blir dette en veldig mettende hverdagsmiddag.",Blomkålsuppe med kikerter og grønnkål,/oppskrifter/Suppe/blomkalsuppe-med-kikerter-og-gronnkal/
2021,34,Fredag,78b7aace-9c0f-4164-86b5-e0b28fb47e1a,"Litt sunnere taco? Prøv denne oppskriften på enkel og god fisketaco med tacokrydret torsk, strimlet kål, guacamole, aioli, lime og koriander. Guacamole kan du kjøpe ferdig eller lage selv.","Taco med torsk, kål og guacamole",/oppskrifter/Taco/taco-med-torsk-guacamole/
2021,34,Lørdag,20832e4c-a03a-4f06-b8cd-62990c922c25,Steamed buns er fløyelsmyke hveteboller som vanligvis fylles med langtidsstekt kjøtt og grønnsaker med asiatiske smaker. Denne oppskriften på bao buns eller pork belly buns passer perfekt til å bruke opp rester av ribbe eller spareribs. Pulled pork kan også brukes i denne oppskriften.,Steamed buns med svinekjøtt,/oppskrifter/Svin/Ribbe/steamed-buns-med-svinekjott/
