year,week,week_day,recipe_id,description,title,url
2022,25,Søndag,ecb762ec-a0db-4fa2-b15e-c6e9380a0be5,"Oppskrift på superenkle bao buns med asiatisk smak! Her kan du variere innholdet basert på hva du allerede har i kjøleskapet. Denne oppskriften fra <a href='/tema/vegetar/hanne-lene'>MENYs vegetarentusiast, Hanne-Lene</a>, blir garantert en ny favoritt!",Asiatiske bao buns,/oppskrifter/vegetar/bao-buns/
2022,25,Ukens bakst,be07711a-2078-959d-90f8-dee3a7771f8e,"Hva med å rocke opp kakebordet til konfirmasjonen, bursdagsselskapet eller mai-festen i år? Denne supertrendy regnbuekaken vil i hvert fall skape noen gisp når den åpnes. Denne oppskriften på regnbuekake med deilig vaniljekake og kremfrosting har detaljerte steg-for-steg bilder som gjør det enkelt!",Regnbuekake,/oppskrifter/kaker/kremkaker/Regnbuekake/
2022,24,Mandag,efb2b751-fba5-4ab1-b04e-649c2583e7e1,"Oppskrift på små, saftige vegetarburgere med kjøttfritt alternativ til pulled pork ,syltet rødløk, mango og guacamole. Vi kallder dem sliders fordi vi lager dem små, men du kan også lage disse som burgere i vanlig størrelse. Vi anbefaler brioche burgerbrød.",Vegetarsliders med mango og syltet rødløk,/oppskrifter/vegetar/vegetarsliders-med-mango-og-syltet-rodlok/
2022,24,Tirsdag,fcf79073-3d02-e0e2-3f87-ef5964f44d65,"Ørret og laks er enkelt og raskt å lage. Sammen med MENYs egen brokkolisalat, Jacobs Utvalgte ramsløksmør og søtpotetmos har du et knallgodt middagstips til hverdagen. Søtpotetmos kan du lage fra bunnen, eller kjøpe ferdig hos MENY. Se egen oppskrift.",Laksefilet med søtpotetmos og brokkolisalat,/oppskrifter/Fisk/Laks/stekt-laks-med-sotpotetmos-og-brokkolisalat/
2022,24,Onsdag,62bda22e-1c5c-4f6f-956b-0ac6397d6e16,"Oppskrift på saftig svinefilet med syltet rødløk, aioli og bønne- og bulgursalat. Med godt og ferdig tilbehør er denne gode retten klar på under 20 minutter. Svinefilet kan gjerne også grilles.",Svinefilet med bønnesalat,/oppskrifter/Svin/Indrefilet-av-svin/svinefilet-med-bonnesalat/
2022,24,Torsdag,20db7f85-1185-4393-b1bc-fb6df4c336ba,"Oppskrift på god sommersalat med spekeskinke, parmesan og bringebær vinaigrette. Herlig forfriskende salat med en uslåelig kombinasjon av salt, syrlig og søtt. Passer perfekt på en varm sommerdag, når du vil imponere gjester eller bare har lyst på noe ekstra godt til lunsj eller middag. Server med godt brød på siden.",Salat med spekeskinke og bringebærvinaigrette,/oppskrifter/salat/salat-med-spekeskinke-og-bringebarvinaigrette/
2022,24,Fredag,dc503c43-a126-c447-2024-76bbe46f7566,Pølse i brød er grillmaten over all grillmat! Ta utgangspunkt i gode Bratwurst pølser fra Jacobs Utvalgte og topp med deilig tilbehør som rødløk og aioli.,Pølse i brød med godt tilbehør,/oppskrifter/Polser/polse-i-brod-med-godt-tilbehor/
2022,24,Lørdag,f2815143-62da-4293-8c73-8876ad52cff9,"Oppskrift på deilig gratinert sjøkreps med ramsløksmør og urter. Et festmåltid som passer perfekt til en sommerkveld med gode venner. Sjøkreps smaker nydelig sammen med godt smør, sitron og loff. Å tilberede sjøkreps er raskere og enklere enn du tror, og de kan også grilles.",Gratinerte sjøkreps med ramsløksmør,/oppskrifter/Skalldyr/gratinerte-sjokreps-med-ramsloksmor/
2022,24,Søndag,d63566fa-4c71-45cf-9d93-cd197c93de25,"Oppskrift på klassisk napolitansk pizza med hvit saus, chorizo, rødløk og oliven. Dette er en pizza med masse smak som går fort å lage i pizzaovnen. Til denne oppskriften trenger du <a href='/oppskrifter/pizza/enkel-italiensk-pizzadeig/'>ferdig hevet grunndeig til pizza</a>.","Hvit pizza med chorizo, rødløk og oliven",/oppskrifter/pizza/hvit-pizza-med-chorizo/
2022,24,Ukens bakst,bfd85c95-6bf4-4b84-8148-47117d35ed1a,"Oppskrift på grillspyd til dessert, med grillet fersken servert med honning, gresk yoghurt og hakkede nøtter. En enkel, lun og sommerlig rett, som både er frisk og søt. Legg spydene rett på grillen eller stek dem i en grillpanne.",Dessertspyd med fersken,/oppskrifter/Dessert/Frukt-og-bar/dessertspyd-med-fersken/
2022,23,Mandag,3215edbf-5de3-468d-88e8-f1875b232d80,"Oppskrift på en spennende rett med smak av Midtøsten - perfekt til mezze eller enkle hverdagsmiddager. <a href='/tema/vegetar/hanne-lene'>MENYs vegetarentusiast, Hanne-Lene</a>, elsker den næringsrike paprikadippen ""Muhammara"" med masse god smak.",Smårett med aubergine,/oppskrifter/vegetar/smarett-med-auberguine/
2022,23,Tirsdag,b667803d-eec8-4e6f-99ee-e90166ff6f9b,"Pokesalat er en spennende og enkel fiskemiddag. Bruk rå lakseloin, råkost og ris, og topp med asiatisk ponzusaus. Retten kan tilpasses etter ønske med for eksempel mango, avokado og granateplekjerner.",Enkel poke med laks,/oppskrifter/Fisk/Laks/enkel-poke-med-laks/
2022,23,Onsdag,b8913d33-d763-4330-aa59-7b4e420ab40d,"Oppskrift på enkel og sommerlig salat med stekt kylling, vannmelon i terninger, fetaost og grønn salat. Veldig god lunsj eller middag på under 20 minutter. Bruk ferdig salatkylling for å spare tid, men du kan også kjøpe rå kyllingfilet og steke selv.",Kyllingsalat med vannmelon,/oppskrifter/Kylling/kyllingsalat-med-vannmelon/
2022,23,Torsdag,08318508-0dcd-4a6e-aceb-5e187c99cb3a,Oppskrift på hjemmelaget ravioli med ricotta og spinat. Lag pastadeigen fra bunnen av og fyll den med smaksrik ricottaost. Server gjerne med ristede pinjekjerner og et dryss parmesan over.,Ravioli med ricotta og spinat,/oppskrifter/Pasta/ravioli-med-ricotta-og-spinat/
2022,23,Fredag,847f3427-f501-4d46-9cc2-fd35629113bb,"Om du har lyst på en sterk hamburger med masse smak og «kick», er dette burgeren for deg. Saftig Angusburger med tørrsaltet bacon, sterk ost, chipotlemajones og tomatsalsa med jalapenos vil garantert sette smaksløkene i sving.",Spicy burger med bacon og chipotlemajones,/oppskrifter/hamburger/spicy-burger-med-bacon-og-chipotlemajones/
2022,23,Lørdag,f7df84da-8465-4bda-92ca-ad5bd25d7187,"Oppskrift på lekkert skalldyrfat som enkelt kan skaleres opp eller ned etter ønske. Dampede blåskjell serveres sammen med de skalldyrene du liker best, for eksempel reker, østers, kongekrabbe og krabbeskjell. Se video for hvordan du damper blåskjell.",Enkelt skalldyrfat,/oppskrifter/Skalldyr/enkelt-skalldyrfat/
2022,23,Søndag,dd48ef94-5cfa-92b5-37c8-acd9c89a66d0,"Møre spareribs med dyp smak av barbecue kan gjøres både på grill og i stekeovn. Sammen med grillet søtpotet og en frisk coleslaw med knas fra eple og fennikel, er dette deilig kosemat for late sommerdager.",Spareribs med grillet søtpotet,/oppskrifter/Svin/Ribbe/Spareribs-med-grillet-sotpotet/
2022,23,Ukens bakst,90792630-80dc-4c8f-807f-0350f07992a7,"En saftig, søt og myk sjokoladekake i langpanne, perfekt til barnebursdag.
Oppskriften er tilpasset én stor langpanne, men kan også gjerne lages i to små, eller som cupcakes. Kaken toppes med en luftig og myk sjokoladekrem, og pynt etter eget ønske. Se video med steg for steg-hjelp for en perfekt kake.",Saftig sjokoladekake med lys sjokoladekrem,/oppskrifter/kaker/sjokoladekaker/saftig-sjokoladekake-med-lys-sjokoladekrem/
2022,22,Mandag,579a4c65-9d98-4310-94a2-d5e1d05fe800,"Enkel middag uten kjøtt eller har du rester? Lag denne enkle pastaretten av grønnsakskraft, tomater og løk. Pasta og grønnsaker i en og samme kjele, som lager seg selv og smaker himmelsk! Topp med jalapeno.",Vegetarisk one pot pasta,/oppskrifter/vegetar/vegetarisk-one-pot-pasta/
2022,22,Tirsdag,bc324a42-a0e0-483c-9c70-9c50e3ff391b,"Fiskekaker egner seg godt som burger, og med en god remulade og revet råkost kan du raskt lage en hjemmelaget versjon av coleslaw. Disse litt sunnere burgerne går raskt å lage. La gjerne barna bli med å lage denne enkle middagen! Oppskriften gir 2 fiskeburgere.",Fiskeburger med enkel coleslaw,/oppskrifter/Fisk/fiskeburger-med-enkel-coleslaw/
2022,22,Onsdag,9a519c0c-6ba4-46ba-964b-6df372d6b0d1,"Dette er en rask oppskrift på stekte koteletter av svin med couscous, i følge med fruktig mango papaya salsa og frisk salat. Veldig god middag på under 20 minutter.",Svinekoteletter med couscoussalat,/oppskrifter/Svin/Koteletter/svinekoteletter-med-couscoussalat/
2022,22,Torsdag,ba614336-2179-d062-ef35-6d6b31adb5b2,"Lite gir så herlig sommerfølelse som stekt makrell. Man kan servere den med mye spennende tilbehør, men en tradisjonell frisk agurksalat og kokte nypoteter med dill, er alltid vellykket. Bruker du grovt rugmel til paneringen, blir dessuten det smakfulle makrellskinnet ekstra sprøtt og får en god tekstur.",Sprøstekt makrell med agurksalat,/oppskrifter/Fisk/Makrell/Sprostekt-makrell-med-agurksalat/
2022,22,Fredag,92999ba4-0212-d1b1-d1c1-b8907d7e23c0,"Ferske reker, loff og majones er gjerne synonymt med sol, sommer og svaberg. Lag en hjemmelaget aioli og topp rekesmørbrødet med sitron og dill. Tips - noen skiver avokado smaker svært godt til.",Loff med ferske reker,/oppskrifter/Skalldyr/Reker/loff-med-ferske-reker/
2022,22,Lørdag,86f857e5-e700-47a3-8d0a-f36827ce68bb,"Oppskrift på helstekt indrefilet av svin, med lun potetsalat og frisk appelsin. Svinekjøtt er magert, mørt og saftig, og kler godt søte smaker av frukt. Vi gir deg stegene for både grill og stekeovn.",Svinefilet med bakt potetsalat og appelsin,/oppskrifter/Svin/Indrefilet-av-svin/svinefilet-med-bakt-potetsalat-og-appelsin/
2022,22,Søndag,b26cf2a1-9b96-156c-8bad-82b121f29ead,"Enkel oppskrift på hvit asparges med fyldig, hjemmelaget hollandaise og salt spekeskinke. Hvit asparges er en delikatesse som passer godt å servere til anledninger som 17. mai, konfirmasjon, dåp og andre feiringer, eller som forrett. Enkel og god rett med asparges, som for mange er smaken av sommer.",Dampet hvit asparges med hollandaisesaus,/oppskrifter/Gronnsaker/Dampet-hvit-asparges-med-hollandaisesaus/
2022,22,Ukens bakst,434c47d3-6683-4ad1-897e-4d0dd77832b2,"Oppskrift på enkel, men imponerende pai med iskrem, friske bær, granateplekjerner og hakket, mørk sjokolade. Her kan du også variere både is og topping etter eget ønske. Perfekt å servere til 17. mai, bursdag eller sommerfest.",Dessertpai med kirsebæris og jordbær,/oppskrifter/Pai/dessertpai-med-kirsebaris-og-jordbar/
2022,21,Mandag,e6e22c9c-c62e-47f4-959c-49a6f5eaa59f,"Oppskrift på rask linsegryte som er enkel å lage, og som har masse smak. Ingen annen oppskrift har blitt laget så mye av <a href='/tema/vegetar/hanne-lene'>MENYs vegetarentusiast, Hanne-Lene</a>, som denne gryten. Skal du bare prøve en linsegryte i ditt liv, er dette den du bør gå for.",Rask linsegryte,/oppskrifter/gryte/rask-linsegryte/
2022,21,Tirsdag,0e3e8416-bda6-42fa-bf66-c82532d2b468,En god og veldig enkel fiskegryte basert på MENYs populære fiskesuppe. Suppen kommer med biter av fersk fisk fra fiskedisken. Her har vi tilsatt ekstra laks og servert med aioli og fersk baguette.,Kremet fiskegryte med laks,/oppskrifter/Suppe/fiskegryte/
2022,21,Onsdag,7f1afb4f-eebe-43f5-a0a7-4d5bc97b6e58,"Oppskrift på rask og enkel sommermat som er god på smak. Denne middagen er perfekt hvis du vil lage noe litt sunnere. Søt appelsin komplementerer svinekjøttet, og strimlet grønnkålmix gir god crunch. Server med mild tzatziki og ovsbakte poteter, og nyt!",Sommerkoteletter med stekt grønnkål og tzatziki,/oppskrifter/Svin/Koteletter/sommerkoteletter-med-tzatziki/
2022,21,Torsdag,43056ba8-45b1-4369-a161-db2f42eccccd,"Oppskrift på smaksrik salat med tynne skiver av pærer, blåmuggost, honning og hakkede valnøtter. Her har vi brukt en feldsalat, men du kan godt bruke ruccula, hjertesalat eller den salaten du liker best. Server den som hovedrett, lunsj eller en del av et koldtbord, gjerne med ferskt brød ved siden av.",Salat med pære og blåmuggost,/oppskrifter/Frukt/salat-med-pare-og-blamuggost/
2022,21,Fredag,4f57599b-2aff-4f7a-a06f-ca0ad431bc27,"Oppskrift på hvit pizza, eller pizza bianca, med spicy, nduja og smaksrik salcicciapølse. En skikkelig smaksbombe av en napolitansk pizza! Til denne oppskriften trenger du <a href='/oppskrifter/pizza/enkel-italiensk-pizzadeig/'>ferdig hevet grunndeig til pizza</a>.",Hvit pizza med nduja og salciccia,/oppskrifter/pizza/hvit-pizza-med-nduja-og-salciccia/
2022,21,Lørdag,8ea6d30c-1236-4f26-932f-f02cc42f3c20,"Oppskrift på salmaburger med chilimajones og syltet rødløk, en nydelig kombo. Fiskeburger i ferske, grove burgerbrød utgjør en rask, god og litt sunnere hverdagsmiddag på under 20 minutter. Du kan gjerne grille burgerne!",Lakseburger med syltet rødløk,/oppskrifter/Fisk/Laks/lakseburger-med-syltet-rodlok/
2022,21,Søndag,ec8b2559-28c1-42d9-bbfe-459ccc18e47c,"Oppskrift på saftig Lerstang kylling fra Gårdsand, med sprøtt skinn og gode grønnsaker. Her bruker vi norske Matskatter fra lokale leverandører, som perlepoteter og urter, sammen med vårens nykål.",Grillet kyllingbryst med nykål og hjemmelaget urtemajones,/oppskrifter/Kylling/grillet-kyllingbryst-med-nykal-og-hjemmelaget-urtemajones/
2022,21,Ukens bakst,bd7a0b8b-3f32-4cf0-a360-f52d85c4e326,"Oppskrift på enkel rabarbrasuppe med jordbær, som kan serveres både kald og varm. Rabarbra er både søtt og syrlig, og i sesong på våren. Suppen holder seg godt i kjøleskapet så restene kan nytes flere dager etter at suppen er laget",Rabarbrasuppe med jordbær,/oppskrifter/Suppe/rabarbrasuppe-med-jordbaer/
2022,20,Mandag,1dd265fa-d7d0-408f-9ab3-bcf42d66211d,"Oppskrift på en skikkelig digg salat fra <a href='/tema/vegetar/hanne-lene'>MENYs egen vegetarentusiast, Hanne-Lene</a>. Med smaksrik, krydret blomkål, sprø kikerter og hjemmelaget dressing er dette et godt alternativ  til den klassiske Cæsarsalaten. Hanne-Lene kaller den Kleopatrasalat.",Blomkålsalat med syrlig dressing,/oppskrifter/salat/blomkalsalat/
2022,20,Tirsdag,ace3bd42-e067-4315-8f47-4ceec812d662,"Sterke pølser passer perfekt med de litt søte brioche pølsebrødene! Topp dem med ruccola, BBQ-saus og syltet rødløk. Kjempegod grillmat, og enkel middag.",Spicy ostepølse med syltet rødløk,/oppskrifter/Polser/spicy-ostepolse-med-syltet-rodlok/
2022,20,Onsdag,48cc0493-79bd-40fb-b5de-4e54a204e090,"Ovnsbakt torsk og grønnsaker er rask, sunn og god middag. Torskefileten kan du legge direkte over grønnsakene og steke i ovnen samtidig. Noen skiver med urtesmør på toppen gir ekstra smak.",Torskefilet med ovnsbakte grønnsaker,/oppskrifter/Fisk/Torsk/torskefilet-med-ovnsbakte-gronnsaker/
2022,20,Torsdag,a7d6fee0-4328-49e4-905e-4d2db097e86f,"Oppskrift på frisk salat med appelsin, grønt eple, fennikel og havreris, toppet med gresskarfrø, salat og basilikum. Salaten serveres med bøffelmozzarella og en frisk appelsindressing.",Frisk salat med appelsindressing,/oppskrifter/salat/salat-med-appelsin-og-appelsin-dressing/
2022,20,Fredag,f519cd7d-a455-466f-9150-978db6cb2cd4,"Oppskrift på sprø taco med kylling, mango, tacokrydder, salsa og granateplekjerner. Topp gjerne også med guacamole.",Kyllingtaco med granateple og mango,/oppskrifter/Kylling/kyllingtaco-med-granateple-og-mango/
2022,20,Lørdag,dda311d2-72d6-e2a0-2af9-7100ee6f57f1,"Blåskjell dampet med hvitvin og hvitløk kan serveres både som hovedrett og forrett. Det er enkelt, raskt og ikke minst veldig godt. Server gjerne nystekt brød og pommes frites til. Denne retten kan også fint lages i folie på grillen. Se video med steg for steg.",Hvitvinsdampede blåskjell,/oppskrifter/Skalldyr/Blaskjell/Hvitvinsdampede-blaskjell/
2022,20,Søndag,a722f5b7-d2f6-4801-930e-7be1497ac0b9,"Enkel oppskrift på hverdagspizza, med ferdig pizzabunn, karbonadedeig, og MENY sin egen tomatsaus med et høyt innhold av grønnsaker. Middag på under 20 minutter. Topp med spinat eller andre grønnsaker du liker. Du kan også bruke kjøttdeig.",Enkel pizza med karbonadedeig,/oppskrifter/pizza/enkel-pizza-med-karbonadedeig/
2022,20,Ukens bakst,e3da6387-da11-2b7e-5b14-208243172e85,"Pavlova er den perfekte kaken til vårens og sommerens selskaper, og i langpanne er kaken ypperlig å servere når du venter mange gjester. Topp den søte marengsbunnen med vaniljekrem og friske bær etter eget ønske.",Pavlova i langpanne med vaniljekrem og bær,/oppskrifter/kaker/kremkaker/pavlova-i-langpanne-med-vaniljekrem-og-bar/
2022,19,Mandag,a5f3bb79-ec0a-a082-ae1b-aeb31e377b79,"En fristende risotto oppskrift. Den krever rikelig med omsorg i tilberedningen, men til gjengjeld kan du glede deg over et fantastisk måltid med masse smak av asparges og vår. For en ekstra frisk smak kan du drysse litt hakket mynte og finrevet sitronskall over den ferdige risottoen.",Risotto med asparges,/oppskrifter/Gronnsaker/Risotto-med-asparges/
2022,19,Tirsdag,14049de0-c3d3-4d94-9b21-9d9de799f226,"Oppskrift på enkel fiskeburger med fiskekake, syrlig eple og tzatziki. Server til lunsj eller middag med grove burgerbrød. Her kan du velge den fiskeburgeren du liker best, men denne uken anbefaler vi klippfiskburger. Litt sunnere middag på under 20 minutter, for hele familien.",Fiskeburger med tzatziki og eple,/oppskrifter/Fisk/fiskeburger-med-tzatziki-og-eple/
2022,19,Onsdag,fda592fc-3294-1ef4-1a20-29cbf6dd56c7,"Enkelt middagstips med smaksrike pølser og godt tilbehør! Prøv lammepølser med frisk tomat- og løksalsa, oliven og basilikum. Bruk gjerne Jacobs Utvalgte lammepølse i denne retten.",Lammepølse med frisk tomat- og løksalsa,/oppskrifter/Polser/Saftig-lammepolse-med-soltorket-tomat-og-fetaost/
2022,19,Torsdag,9be16ef8-114c-6534-494c-06297595e7ca,"Kokte nudler toppes med knasende sprø grønnsaker og sesamstekt laks i tynne skiver, og toppes med en deilig dressing av soya og lime. Laksen skal kun stekes i få sekunder over sterk varme og må være av ypperste kvalitet. Dressingen rører du enkelt sammen til slutt!",Sesamstekt laks med soyadressing,/oppskrifter/Fisk/Laks/Sesamstekt-laks-med-soyadressing/
2022,19,Fredag,899cbb57-3082-a006-82cb-c693f834a33e,"Server et vakkert spekefat som en lett middag. Et tradisjonelt norsk spekefat har gjerne tilbehør som potetsalat, rømme, flatbrød og eggerøre. Spør oss gjerne i butikk etter gode norske Matskatter når du skal handle spekemat. Beregn ca 150 gram spekemat per person.",Norsk spekefat,/oppskrifter/spekemat/Norsk-spekefat/
2022,19,Lørdag,f21f4064-8bc7-4f98-abe9-00ebbfbe0417,"Oppskrift på fersk, saftig og enkel hamburger med grove hamburgerbrød og coleslaw du kan kjøpe ferdig. Denne burgeren er perfekt for deg som vil lage en rask, enkel og god middag for hele familien, på under 20 minutter. Server gjerne med pommes frites eller en frisk salat!",Enkel hamburger med coleslaw,/oppskrifter/hamburger/hamburger-med-coleslaw/
2022,19,Søndag,da59eb22-e262-4d68-8156-fa9c533bd14c,"Oppskrift på en smaksrik og helt kjøttfri kofta som vi finner frem når vi virkelig skal imponere. Enkle råvarer, kompleks smak og virkelig en rett verdig et festbord eller til meze. Denne vegetar-varianten er en av <a href='/tema/vegetar/hanne-lene'>MENYs vegetarentusiast, Hanne-Lenes</a> favorittoppskrifter. En god <a href='/oppskrifter/Sauser-og-dressinger/mango-chutney/'>mangochutney er et must til denne retten.</a>",Kjøttfri indisk kofta,/oppskrifter/vegetar/indisk-kofta/
2022,19,Ukens bakst,c7aa47ad-88cd-62a5-f3e7-547b1ff1b84b,"Enkel og klassisk oppskrift på ostekake med smak av sitron, pyntet med bær. Denne ostekaken har sitrongelé blandet inn i røren, noe som gjør at den blir lett og luftig i konsistensen, og frisk og god i smaken. Til bunnen kan du bruke de kjeksene du liker best, vi har brukt digestive i denne oppskriften. Se også video.",Ostekake med sitrongele,/oppskrifter/kaker/ostekaker/Ostekake-med-sitrongele/
2022,18,Mandag,3653ae58-2abb-49ae-926b-5acca8571cb8,"Oppskrift på mettende vegetarsalat med grillet halloumi, ruccola, tomater og bønner. En frisk og fargerik salat, perfekt på våren og sommeren. Salaten er enkel å lage, og de milde smakene passer til hele familien. Halloumi er en fyldig ost som egner seg godt på grillen, og som smaker best når den er varm.",Halloumisalat,/oppskrifter/vegetar/halloumisalat/
2022,18,Tirsdag,0ab4a05a-18a9-4683-b73d-db7d82da4be6,"Oppskrift på laks i folie, en veldig enkel måte å tilberede en enkel og smakfull middag. Med alt i en pakke kan den varmes på grillen, i ovnen eller til og med på bålet om du skal ut på tur. Dette er også en rett som gjør det litt mer spennende for barn å spise fisk.",Laks i folie med ramsløksmør,/oppskrifter/Fisk/Laks/laks-i-folie-med-ramsloksmor/
2022,18,Onsdag,62bda22e-1c5c-4f6f-956b-0ac6397d6e16,"Oppskrift på saftig svinefilet med syltet rødløk, aioli og bønne- og bulgursalat. Med godt og ferdig tilbehør er denne gode retten klar på under 20 minutter. Svinefilet kan gjerne også grilles.",Svinefilet med bønnesalat,/oppskrifter/Svin/Indrefilet-av-svin/svinefilet-med-bonnesalat/
2022,18,Torsdag,6ef2d88c-ab84-06db-b0cf-e76c29bbb834,"Oppskrift på trukket, lettsaltet torsk med erter og serranoskinke. God og enkel middag. Vanlig torskefilet kan også brukes og serranoskinke kan byttes ut med spekeskinke eller bacon.",Lettsaltet torsk med erter og serranoskinke,/oppskrifter/Fisk/Torsk/Lettsaltet-torsk-med-erter-og-serranoskinke/
2022,18,Fredag,e23744df-1331-4862-8330-e93b8fdbdfdf,"Oppskrift med vår beste burger, Angusburgeren, toppet med klassiske smaker som god cheddar, sennep, bacon og fritert løk. Vi kaller den ""The Perfect bite"". En fyldig og god burger som er perfekt å grille om sommeren. Litt Rørosrømme er også godt på denne burgeren.","Klassisk Angusburger med cheddar, bacon og sprøstekt løk",/oppskrifter/hamburger/klassisk-angusburger-med-cheddar-bacon-og-sprostekt-lok/
2022,18,Lørdag,7ec41490-df3a-e7c7-2e65-9c75e38b0ad8,Ostepølse toppet med tomatsalsa og nachochips er et godt alternativ til fredagstacoen! Perfekt på grillen og passer for hele familien.,Saftig ostepølse med nachochips,/oppskrifter/Polser/Saftig-ostepolse-med-nachochips/
2022,18,Søndag,336b7e1f-e247-42fd-aeb4-2e1890cda3d9,"Oppskrift på den kjente, spicy pizzaen Diavola med salami, Nduja (som er en sterk smørbarbar salami), og rødløk. På italiensk betyr pizza diavola ""djevelens"" pizza. Og i dette tilfellet betyr djevelen én ting: sterk.",Pizza Diavola,/oppskrifter/pizza/pizza-diavola/
2022,18,Ukens bakst,06ffd237-bca5-439d-81fc-1bc427603c46,"Oppskrift på søt og saftig fruktkake som også kalles ""Humming Bird cake"". Kolibrikake er en saftig krydderkake med ananas og banan som pyntes med deilig ostekrem. Topp den gjerne med spiselige blomster i alle regnbuens farger eller pekannøtter.",Kolibrikake med ananas og banan,/oppskrifter/kaker/Frukt--og-barkaker/kolibrikake/
2022,17,Mandag,7fd6d1a0-8606-4d74-be8e-72eac593523e,"Buddha bowl er navnet på vegetarvarianten av poke. Retten består av små porsjoner av ulike grønnsaker med mer, og serveres kald i en skål. I denne oppskriften har vi brukt pulled vegetar, sushiris og friske, sprø grønnsaker.",Vegetarisk Buddha bowl,/oppskrifter/vegetar/vegetarisk-buddha-bowl/
2022,17,Tirsdag,5e979e77-ba10-4bd4-ad36-f2a82d393b5e,"Enkel, sunn og rask fiskemiddag med ørretfilet, potetmos og grønnkål mix. Ørreten har vi penslet med szechuan saus, som gir masse god smak. Ørret er ganske lik laks på smak, og de to fiskene passer det samme tilbehøret.",Stekt ørret med szechuan saus,/oppskrifter/Fisk/pannestekt-orretfilet/
2022,17,Onsdag,b4cebb07-2732-4d85-b331-c53f87f390d0,"Oppskrift på rask, god og enkel middag med strimlet kylling. Med utgangspunkt i en ferdig pastasalat kan du raskt supplere med ekstra grønnsaker og stekt kylling. Topp med en god dressing og server gjerne med ferskt brød.",Pastasalat med kylling,/oppskrifter/Pasta/pastasalat-med-kylling/
2022,17,Torsdag,76d6adbd-7ecb-ac4d-6850-90e5581f9548,"En enkel og god terte fylt med krabbe. Denne oppskriften på pai med krabbe passer godt på et koldtbord eller som en selvstendig rett, servert med tomatsalat og godt brød til.",Krabbeterte med tomatsalat,/oppskrifter/Pai/Krabbeterte-med-tomatsalat/
2022,17,Fredag,a2a6c2bf-b6da-462b-aa90-96903a754b21,"Oppskrift på saftig Angusburger servert med hjemmelaget coleslaw, gode sauser og smeltet ost - det perfekte måltidet til helgen. Denne burgeren er utrolig smakfull, samtidig som den er enkel å lage. Server gjerne med hjemmelagde fries. Kjøp vår beste burger i ferskvaredisken, og tilbered den gjerne på grill!",BBQ cheeseburger med coleslaw,/oppskrifter/hamburger/bbq-cheeseburger-med-coleslaw/
2022,17,Lørdag,2ed8765f-30ad-409c-ab83-ba6a88e45c36,"Oppskrift på napolitansk pizza finocchiona, en italiensk klassiker med tomatsaus og salami, toppet med grønn pesto og god ost. Til denne oppskriften trenger du <a href='/oppskrifter/pizza/enkel-italiensk-pizzadeig/'>ferdig hevet grunndeig til pizza</a>.",Pizza Finocchiona,/oppskrifter/pizza/pizza-finocchiona/
2022,17,Søndag,ace3bd42-e067-4315-8f47-4ceec812d662,"Sterke pølser passer perfekt med de litt søte brioche pølsebrødene! Topp dem med ruccola, BBQ-saus og syltet rødløk. Kjempegod grillmat, og enkel middag.",Spicy ostepølse med syltet rødløk,/oppskrifter/Polser/spicy-ostepolse-med-syltet-rodlok/
2022,17,Ukens bakst,557d638b-114b-4122-a552-e18946dc77f2,"Oppskrift på enkel, hjemmelaget vaniljeis, eller isparfait som det også heter når du lager is på denne måten. Her trenger du ikke iskremmaskin, kun en håndmikser, og du trenger ikke å røre underveis når isen fryses. Oppskriften er til ca. 10 porsjoner. Se steg for steg i video.",Hjemmelaget iskrem,/oppskrifter/Dessert/Is-og-sorbet/hjemmelaget-iskrem/
2022,16,Mandag,3e22f61b-e49d-478f-b290-f776c3898405,"Hos oss i MENY kan du kjøpe et utvalg kjøtfrie pølser, som kan grilles eller stekes slik som andre pølser. Du kan også bruke det samme tilbehøret som du pleier. La deg inspirere av våre forslag i denne oppskriften.",Vegetarpølser med godt tilbehør,/oppskrifter/vegetar/vegetarpolser-med-godt-tilbehor/
